{
  "principal_id": "11111111-1111-4111-8111-111111111111",
  "type": "business",
  "verification_tier": 2,
  "ubo_cluster_id": "0xb2b2b2b2b2b2b2b2b2b2b2b2b2b2b2b2b2b2b2b2b2b2b2b2b2b2b2b2b2b2b2b2",
  "kyb_providers": [
    "kyb-provider-alpha"
  ],
  "jurisdiction": "US",
  "sanctions_status": {
    "screened_at": "2026-07-01T00:00:00Z",
    "result": "clear"
  },
  "caps": {
    "per_pool": "50000000000",
    "monthly": "250000000000"
  },
  "standing": "good"
}
